date_checked,time_local,platform,message_entry_url,supplier_contact,supplier_name,reply_status,latest_reply_summary,document_status,sample_or_moq_status,recommended_next_action,notes
2026-06-21,13:10,Alibaba,https://onetalk.alibaba.com/message/weblitePWA.htm#/,Alisa Zhang,Changchun Ai Kun Medical Equipment Co. Ltd.,replied,"Asked to confirm candle style; sent `2025-Aikun Candle Catalog.pdf`; stated samples cost USD 50 each and asked for email.",catalog_pdf_received_in_chat,"Samples USD 50 each; public product MOQ 100.",reply in Alibaba chat with target style and ask for compliance docs/sample shipping cost before sharing email,"Potential lead but sample cost is high for EUR 500 validation unless documents and sample fit are strong."
2026-06-21,13:10,Alibaba,https://onetalk.alibaba.com/message/weblitePWA.htm#/,Betty Xu,Hebei Aoyin Trading Co. Ltd.,replied,"Said they support EU exports with soy wax and CLP labels; samples available; no catalog; MOQ 500 pcs; later said they will carefully review the message.",no_docs_received,"MOQ 500 pcs.",ask for SDS/IFRA/allergen/REACH/CLP examples and existing sample cost; reject for production if MOQ cannot drop,"EU/CLP claim is useful but unverified; MOQ too high for first validation batch."
2026-06-21,13:10,Alibaba,https://onetalk.alibaba.com/message/weblitePWA.htm#/,wang renji,Shanghai Wellness Crafts Co. Ltd.,replied,"Thanked us and said they will get back Monday.",no_docs_received,"Public product MOQ 600 pcs.",wait for Monday follow-up,"No substantive answer yet."
2026-06-21,13:10,Alibaba,https://onetalk.alibaba.com/message/weblitePWA.htm#/,Cathy Lv,Suzhou M&scent Arts&crafts Co. Ltd.,replied,"First claimed REACH/CLP and EN15493/15494 safety reports, private label MOQ 100, ready soy wax samples, Trade Assurance; then clarified stock products cannot support customization, glass candle MOQ 500 pcs per design/color/scent, ceramic MOQ 2000 pcs per design with 2 colors mixed.",claims_unverified,"Stock samples possible; customization MOQ 500 glass or 2000 ceramic.",ask if existing stock samples can be bought without customization and request actual document examples; deprioritize custom route,"Conflicting MOQ answers. Production route is likely too high for EUR 500 validation."
2026-06-21,13:10,Alibaba,https://onetalk.alibaba.com/message/weblitePWA.htm#/,kevin gao,Suzhou Enjoy Home Products Co. Ltd.,replied,"Said they will check with manager; then stated scented candle gift box MOQ is 500 pcs and asked if quantity is okay.",no_docs_received,"MOQ 500 pcs.",reply that 500 is too high for first test; ask existing sample cost and documents only,"High MOQ; keep only if sample path and EU docs are strong."
2026-06-21,13:10,Alibaba,https://onetalk.alibaba.com/message/weblitePWA.htm#/,Linda liu,Shijiazhuang Gaocheng Fengyuan Candle Co. Ltd.,replied,"Said they have 16 years of EU export experience and will check compliance docs and MOQ with manager; asked best way to send sample details.",no_docs_received,"Product page shows carton-based MOQ 1 box.",ask them to send sample details and document examples inside Alibaba chat,"Interesting as export-document benchmark; product direction is less premium/soy aligned."
2026-06-21,13:10,Alibaba,https://onetalk.alibaba.com/message/weblitePWA.htm#/,Jasen tan,Hubei Joylife Home Furnishing Co. Ltd.,replied,"Said they will check with manager and handle it Monday.",no_docs_received,"Product visible MOQ 10 pcs for rapeseed wax amber candle gift.",wait for Monday follow-up; keep high priority due low sample MOQ and rapeseed wax fit,"High potential validation lead if documents are credible."
2026-06-21,13:10,Alibaba,https://onetalk.alibaba.com/message/weblitePWA.htm#/,Amy,Guangxi Wanjing Xiangyu Biotechnology Co. Ltd.,no_text_reply,"Only product card visible in thread; no substantive text reply found.",no_docs_received,"Product visible MOQ 36 pcs.",wait or send short follow-up later,"Low MOQ is useful, but no answer yet."
2026-06-21,13:10,Alibaba,https://onetalk.alibaba.com/message/weblitePWA.htm#/,Ella Yang,Baoding Be-Ladies Home Products Co. Ltd.,no_text_reply,"Only product card visible in thread; no substantive text reply found.",no_docs_received,"Product visible MOQ 300 pcs.",wait or send short follow-up later,"Germany main-market claim from product page remains unverified."
